ProductId;ProductNumber;ProductName;Groups;ProductType;ProductPriceType;ProductPrice;ProductStock;RelatedProducts;ProductShortDescription;ProductLongDescription;ProductImageSmall;ProductImageMedium;ProductImageLarge;Document;ProductPriceFrom;Color;Ancho;Fondo;Colocacion
PR001;PR001;Conjunto CHICK 80cm Olmo Blanco;GR002,GR051,GR055;2;1;498.5;100;PR002;Conjunto compuesto por el mueble CHIC de 80cm y acabado Olmo Blanco.<br>Incluye el lavabo de porcelana CODIGO II de 80x45 cm y espejo MADISON de 80x80cm.;<table><tr><td>Referencia</td><td>00CHICK6</td></tr><tr><td>Ancho</td><td>80 cm</td></tr><tr><td>Colocación</td><td>Con Patas</td></tr><tr><td>Color</td><td>Olmo blanco</td></tr><tr><td>Fondo</td><td>45 cm</td></tr><tr><td>Marca</td><td>GAMMA TATTOM</td></tr><tr><td>Medidas</td><td>80 x 85 x 45 cm</td></tr></table>;/Images/Ecom/Gamma_ImagesProducts/PR001.jpg;/Images/Ecom/Gamma_ImagesProducts/PR001.jpg;/Images/Ecom/Gamma_ImagesProducts/PR001.jpg;;;Blanco;80;45;Con patas
PR002;PR002;Conjunto CHIC 80cm Roble Hera;GR002,GR052,GR056;2;1;496;100;;Conjunto compuesto por el mueble CHIC de 80cm en acabado Roble Hera.<br>Lavabo CODIGO II y espejo arenado LOOK 70X80cm;<table><tr><td>Referencia</td><td>00CHICK5</td></tr><tr><td>Ancho</td><td>80 cm</td></tr><tr><td>Colocación</td><td>Con Patas</td></tr><tr><td>Color</td><td>Roble</td></tr><tr><td>Fondo</td><td>45 cm</td></tr><tr><td>Marca</td><td>GAMMA TATTOM</td></tr><tr><td>Medidas</td><td>80 x 85 x 45 cm</td></tr></table>;/Images/Ecom/Gamma_ImagesProducts/PR002.jpg;/Images/Ecom/Gamma_ImagesProducts/PR002.jpg;/Images/Ecom/Gamma_ImagesProducts/PR002.jpg;;;Roble;80;45;Con patas
PR003;PR003;Conjunto SENYA Suspendido 80cm Fresno Tea;GR002,GR053,GR057;2;1;380;100;;Conjunto compuesto por el mueble suspendido SENYA de 80cm en color Fresno Tea.<br>Lavabo de porcelana CODIGO II de 81x46cm y espejo con marco de arenado LOOK de 80x80cm.<br>Las medidas del mueble suspendido SENYA son: Ancho: 80cm Alto: 56.5cm Fondo:45.5cm;<table><tr><td>Referencia</td><td>00SENYA3</td></tr><tr><td>Ancho</td><td>80 cm</td></tr><tr><td>Colocación</td><td>Suspendido</td></tr><tr><td>Color</td><td>Madera</td></tr><tr><td>Fondo</td><td>45.5 cm</td></tr><tr><td>Marca</td><td>GAMMA TATTOM</td></tr></table>;/Images/Ecom/Gamma_ImagesProducts/PR003.jpg;/Images/Ecom/Gamma_ImagesProducts/PR003.jpg;/Images/Ecom/Gamma_ImagesProducts/PR003.jpg;;;Fresno;80;45.5;Suspendido
PR004;PR004;Conjunto CHIC Suspendido 80cm Roble Hera;GR002,GR051,GR058;2;1;549;100;;Conjunto compuesto por el mueble suspendido CHIC de 80 cm en acabado Roble Hera.<br>Lavabo CODIGO II y espejo camerino CHIC de 80x70cm;<table><tr><td>Referencia</td><td>00CHICK7</td></tr><tr><td>Ancho</td><td>80 cm</td></tr><tr><td>Colocación</td><td>Suspendido</td></tr><tr><td>Color</td><td>Roble</td></tr><tr><td>Fondo</td><td>45 cm</td></tr><tr><td>Marca</td><td>GAMMA TATTOM</td></tr><tr><td>Medidas</td><td>80 x 85 x 45 cm</td></tr></table>;/Images/Ecom/Gamma_ImagesProducts/PR004.jpg;/Images/Ecom/Gamma_ImagesProducts/PR004.jpg;/Images/Ecom/Gamma_ImagesProducts/PR004.jpg;;;Roble;80;45;Suspendido
PR005;PR005;Conjunto SMART estepa;GR002,GR052,GR059;2;1;189;100;;Conjunto SMART en color estepa. Es pequeño, práctico y funcional.<br>Incluye mueble en color estepa, lavabo de porcelana y espejo con estante del mismo color que el mueble.<br>Disponible en color blanco, negro, wengué y ceniza. Medidas: ancho: 44,5cm, fondo: 30cm y alto: 60cm (incluyendo el lavabo). Espejo de 44x60cm.;<table><tr><td>Referencia</td><td>SMART030</td></tr><tr><td>Ancho</td><td>45 cm</td></tr><tr><td>Colocación</td><td>Suspendido</td></tr><tr><td>Color</td><td>Estepa</td></tr><tr><td>Ean</td><td>8435233859361</td></tr><tr><td>Fondo</td><td>30 cm</td></tr></table>;/Images/Ecom/Gamma_ImagesProducts/PR005.jpg;/Images/Ecom/Gamma_ImagesProducts/PR005.jpg;/Images/Ecom/Gamma_ImagesProducts/PR005.jpg;;;Estepa;Otro;30;Suspendido
PR006;PR006;Conjunto CHIC suspendido roble hera de 80 cm;GR002,GR053,GR055;2;1;543;100;;Conjunto compuesto por el mueble suspendido CHIC de 80 cm en acabado roble hera, lavabo CODIGO II, espejo PLAN de 80x70 cm y aplique PULSAR 60 cromo.;<table><tr><td>Referencia</td><td>00CHICK11</td></tr><tr><td>Ancho</td><td>80 cm</td></tr><tr><td>Colocación</td><td>Suspendido</td></tr><tr><td>Ean</td><td>8435233878232</td></tr><tr><td>Fondo</td><td>45 cm</td></tr><tr><td>Marca</td><td>GAMMA TATTOM</td></tr></table>;/Images/Ecom/Gamma_ImagesProducts/PR006.jpg;/Images/Ecom/Gamma_ImagesProducts/PR006.jpg;/Images/Ecom/Gamma_ImagesProducts/PR006.jpg;;;Roble;80;45;Suspendido
PR007;PR007;Conjunto SMART blanco;GR002,GR051,GR056;2;1;185;100;;Conjunto SMART en color blanco brillo. Es pequeño, práctico y funcional.<br>Incluye mueble en color blanco brillo, lavabo de porcelana y espejo con estante del mismo color que el mueble.<br>Disponible en color blanco, negro, wengué y ceniza. Medidas: ancho: 44,5cm, fondo: 30cm y alto: 60cm (incluyendo el lavabo). Espejo de 44x60cm.;<table><tr><td>Referencia</td><td>SMART010</td></tr><tr><td>Ancho</td><td>45 cm</td></tr><tr><td>Colocación</td><td>Suspendido</td></tr><tr><td>Ean</td><td>8435233859347</td></tr><tr><td>Fondo</td><td>30 cm</td></tr></table>;/Images/Ecom/Gamma_ImagesProducts/PR007.jpg;/Images/Ecom/Gamma_ImagesProducts/PR007.jpg;/Images/Ecom/Gamma_ImagesProducts/PR007.jpg;;;Blanco;Otro;30;Suspendido
PR008;PR008;Conjunto SENYA fresno tea suspendido de 80x46 cm;GR002,GR052,GR057;2;1;462.5;100;;Conjunto compuesto por el mueble suspendido SENYA de 80 cm en color Fresno Tea, lavabo CODIGO II centro, espejo PLAN de 80x70 cm y aplique PULSAR 45 cromo.;<table><tr><td>Referencia</td><td>00SENYA6</td></tr><tr><td>Ancho</td><td>80 cm</td></tr><tr><td>Colocación</td><td>Suspendido</td></tr><tr><td>Ean</td><td>8435233878331</td></tr><tr><td>Fondo</td><td>46 cm</td></tr><tr><td>Marca</td><td>GAMMA TATTOM</td></tr></table>;/Images/Ecom/Gamma_ImagesProducts/PR008.jpg;/Images/Ecom/Gamma_ImagesProducts/PR008.jpg;/Images/Ecom/Gamma_ImagesProducts/PR008.jpg;;;Fresno;80;46;Suspendido
PR009;PR009;Conjunto FAN suspendido grafito de 80 cm;GR002,GR053,GR058;2;1;406.5;100;;Conjunto formado por el mueble FAN suspendido grafito de 80 cm, lavabo CODIGO II, espejo HAFA grafito de 80x90 cm y aplique PULSAR 45 cromo.;<table><tr><td>Referencia</td><td>00FANSU3</td></tr><tr><td>Ancho</td><td>80 cm</td></tr><tr><td>Colocación</td><td>Suspendido</td></tr><tr><td>Color</td><td>Grafito</td></tr><tr><td>Ean</td><td>8435233872551</td></tr><tr><td>Fondo</td><td>45 cm</td></tr><tr><td>Marca</td><td>GAMMA TATTOM</td></tr></table>;/Images/Ecom/Gamma_ImagesProducts/PR009.jpg;/Images/Ecom/Gamma_ImagesProducts/PR009.jpg;/Images/Ecom/Gamma_ImagesProducts/PR009.jpg;;;Grafito;80;45;Suspendido
PR010;PR010;Mueble FAN suspendido 60cm Blanco;GR003,GR051,GR059;0;0;149;100;;Mueble FAN suspendido de 60cm en color Blanco. Mueble de 2 cajones con cierre amortiguado. Primer cajón con hendidura para salvar el sifón.<br>Disponible en las medidas de 60, 70 y 80cm. Medidas Ancho:60cm Fondo:45cm Alto:55cm;<table><tr><td>Referencia</td><td>FANSU060</td></tr><tr><td>Ancho</td><td>60 cm</td></tr><tr><td>Colocación</td><td>Suspendido</td></tr><tr><td>Color</td><td>Blanco</td></tr><tr><td>Ean</td><td>8435233872513</td></tr><tr><td>Fondo</td><td>45 cm</td></tr><tr><td>Marca</td><td>GAMMA TATTOM</td></tr></table>;/Images/Ecom/Gamma_ImagesProducts/PR010.jpg;/Images/Ecom/Gamma_ImagesProducts/PR010.jpg;/Images/Ecom/Gamma_ImagesProducts/PR010.jpg;;;Blanco;60;45;Suspendido
PR011;PR011;Muebles FAN suspendidos;GR003,GR052,GR055;0;0;139;100;;Muebles FAN suspendidos de 60 y 70cm en color Blanco y 80cm en color blanco, burdeos, grafito y beige. Mueble de 2 cajones con cierre amortiguado. Primer cajón con hendidura para salvar el sifón.<br>Medidas Ancho:60cm Fondo:45cm Alto:55cm;<table><tr><td>Referencia</td><td>00FANSU2</td></tr><tr><td>Colocación</td><td>Suspendido</td></tr><tr><td>Marca</td><td>GAMMA TATTOM</td></tr></table>;/Images/Ecom/Gamma_ImagesProducts/PR011.jpg;/Images/Ecom/Gamma_ImagesProducts/PR011.jpg;/Images/Ecom/Gamma_ImagesProducts/PR011.jpg;;TRUE;;Otro;;Suspendido
PR012;PR012;Mueble suspendido SENYA 80cm fresno tea;GR003,GR053,GR056;0;0;244.5;100;;Mueble suspendido SENYA 80cm. El color de los muebles se presenta en melanina color fresno tea y con textura de madera natural lo que hace muy atractiva a esta serie.<br>Los cajones disponen de sistema soft close integrado, para un cierre suave del cajón, y extracción total, lo que permite un máximo aprovechamiento del espacio. Los laterales del cajón son de madera y el interior dispone de acabado en color textil. Detalles que hacen de este mueble la apuesta perfecta para tu baño.<br>Ancho: 80cm Alto: 56,5cm Fondo:45,5cm;<table><tr><td>Referencia</td><td>SENYA080</td></tr><tr><td>Ancho</td><td>80 cm</td></tr><tr><td>Colocación</td><td>Suspendido</td></tr><tr><td>Color</td><td>Madera</td></tr><tr><td>Ean</td><td>8435233878331</td></tr><tr><td>Fondo</td><td>45.5 cm</td></tr><tr><td>Marca</td><td>GAMMA TATTOM</td></tr><tr><td>Medidas</td><td>80 x 56.5 x 45.5 cm</td></tr></table>;/Images/Ecom/Gamma_ImagesProducts/PR012.jpg;/Images/Ecom/Gamma_ImagesProducts/PR012.jpg;/Images/Ecom/Gamma_ImagesProducts/PR012.jpg;;;Fresno;80;45.5;Suspendido
PR013;PR013;Mueble FAN suspendido 80cm Beige;GR003,GR051,GR057;0;0;179;100;;Mueble FAN suspendido de 80cm en color Beige. Mueble de 2 cajones con cierre amortiguado. Primer cajón con hendidura para salvar el sifón.<br>Disponible en color blanco, burdeos, grafito y beige. Medidas Ancho:80cm Fondo:45cm Alto:55cm;<table><tr><td>Referencia</td><td>FANSU081</td></tr><tr><td>Ancho</td><td>80 cm</td></tr><tr><td>Colocación</td><td>Suspendido</td></tr><tr><td>Color</td><td>Beige</td></tr><tr><td>Ean</td><td>8435233872544</td></tr><tr><td>Fondo</td><td>45 cm</td></tr><tr><td>Marca</td><td>GAMMA TATTOM</td></tr></table>;/Images/Ecom/Gamma_ImagesProducts/PR013.jpg;/Images/Ecom/Gamma_ImagesProducts/PR013.jpg;/Images/Ecom/Gamma_ImagesProducts/PR013.jpg;;;Beige;80;45;Suspendido
PR014;PR014;Mueble MATTY a suelo 80cm blanco;GR003,GR052,GR058;0;0;139;100;;Mueble de baño MATTY a suelo de 80cm en color blanco. Mueble de 2 puertas y 2 cajones.<br>Disponible en las medidas de 60, 70, 80 y 100cm.<br>Disponible en color xacobeo. Ancho de 80cm, fondo de 45cm i alto de 82cm;<table><tr><td>Referencia</td><td>MATTY080</td></tr><tr><td>Ancho</td><td>80 cm</td></tr><tr><td>Colocación</td><td>Con Patas</td></tr><tr><td>Ean</td><td>8435233862217</td></tr><tr><td>Fondo</td><td>45 cm</td></tr></table>;/Images/Ecom/Gamma_ImagesProducts/PR014.jpg;/Images/Ecom/Gamma_ImagesProducts/PR014.jpg;/Images/Ecom/Gamma_ImagesProducts/PR014.jpg;;;Blanco;80;45;Con patas
PR015;PR015;Mueble FAN suspendido 70cm Blanco;GR003,GR053,GR059;0;0;162.5;100;;Mueble FAN suspendido de 70cm en color Blanco. Mueble de 2 cajones con cierre amortiguado. Primer cajón con hendidura para salvar el sifón.<br>Disponible en las medidas de 60, 70 y 80cm. Medidas Ancho:70cm Fondo:45cm Alto:55cm;<table><tr><td>Referencia</td><td>FANSU070</td></tr><tr><td>Ancho</td><td>70 cm</td></tr><tr><td>Colocación</td><td>Suspendido</td></tr><tr><td>Color</td><td>Blanco</td></tr><tr><td>Ean</td><td>8435233872520</td></tr><tr><td>Fondo</td><td>45 cm</td></tr><tr><td>Marca</td><td>GAMMA TATTOM</td></tr></table>;/Images/Ecom/Gamma_ImagesProducts/PR015.jpg;/Images/Ecom/Gamma_ImagesProducts/PR015.jpg;/Images/Ecom/Gamma_ImagesProducts/PR015.jpg;;;Blanco;70;45;Suspendido
PR016;PR016;Muebles MATTY Suspendidos Blanco;GR003,GR051,GR055;0;0;115;100;;Mueble MATTY, un mueble básico que no sólo se adapta a cualquier espacio, si no que también lo hace a cualquier necesidad.<br>El mueble MATTY suspendido está disponible en las medidas de 60, 70 y 80cm. Fondo: 45cm. Alto: 55cm;<table><tr><td>Referencia</td><td>00MATTY2</td></tr></table>;/Images/Ecom/Gamma_ImagesProducts/PR016.jpg;/Images/Ecom/Gamma_ImagesProducts/PR016.jpg;/Images/Ecom/Gamma_ImagesProducts/PR016.jpg;;TRUE;Blanco;Otro;;
PR017;PR017;Mueble FAN suspendido 80cm Grafito;GR003,GR052,GR056;0;0;179;100;;Mueble FAN suspendido de 80cm en color Grafito. Mueble de 2 cajones con cierre amortiguado. Primer cajón con hendidura para salvar el sifón.<br>Disponible en color blanco, burdeos, grafito y beige. Medidas Ancho:80cm Fondo:45cm Alto:55cm;<table><tr><td>Referencia</td><td>FANSU082</td></tr><tr><td>Ancho</td><td>80 cm</td></tr><tr><td>Colocación</td><td>Suspendido</td></tr><tr><td>Color</td><td>Grafito</td></tr><tr><td>Ean</td><td>8435233872551</td></tr><tr><td>Fondo</td><td>45 cm</td></tr><tr><td>Marca</td><td>GAMMA TATTOM</td></tr></table>;/Images/Ecom/Gamma_ImagesProducts/PR017.jpg;/Images/Ecom/Gamma_ImagesProducts/PR017.jpg;/Images/Ecom/Gamma_ImagesProducts/PR017.jpg;;;Grafito;80;45;Suspendido
PR018;PR018;Mueble MATTY a suelo 100cm blanco;GR003,GR053,GR057;0;0;174.5;100;;Mueble de baño MATTY a suelo de 100cm en color blanco. Mueble de 2 puertas y 2 cajones.<br>Disponible en las medidas de 60, 70, 80 y 100cm.<br>Disponible en color blanco. Medidas: ancho: 100cm, fondo: 45cm y alto: 82cm;<table><tr><td>Referencia</td><td>MATTY100</td></tr><tr><td>Ancho</td><td>100 cm</td></tr><tr><td>Ean</td><td>8435233862231</td></tr><tr><td>Fondo</td><td>45 cm</td></tr></table>;/Images/Ecom/Gamma_ImagesProducts/PR018.jpg;/Images/Ecom/Gamma_ImagesProducts/PR018.jpg;/Images/Ecom/Gamma_ImagesProducts/PR018.jpg;;;Blanco;100;45;
PR019;PR019;Mueble FAN suspendido 80cm blanco;GR003,GR051,GR058;0;0;166.5;100;;Mueble FAN suspendido de 80cm en color blanco. Mueble de 2 cajones con cierre amortiguado. Primer cajón con hendidura para salvar el sifón.<br>Disponible en las medidas de 60, 70 y 80cm en color blanco y disponible en la medida de 80cm en color blanco, burdeos, grafito y beige. Medidas Ancho:80cm Fondo:45cm Alto:55cm;<table><tr><td>Referencia</td><td>FANSU080</td></tr><tr><td>Ancho</td><td>80 cm</td></tr><tr><td>Colocación</td><td>Suspendido</td></tr><tr><td>Color</td><td>Blanco</td></tr><tr><td>Ean</td><td>8435233872537</td></tr><tr><td>Fondo</td><td>45 cm</td></tr><tr><td>Marca</td><td>GAMMA TATTOM</td></tr></table>;/Images/Ecom/Gamma_ImagesProducts/PR019.jpg;/Images/Ecom/Gamma_ImagesProducts/PR019.jpg;/Images/Ecom/Gamma_ImagesProducts/PR019.jpg;;;Blanco;80;45;Suspendido
PR020;PR020;Muebles FAN a suelo;GR003,GR052,GR059;0;0;139;100;;Mueble FAN a suelo. Mueble de 2 cajones con cierre amortiguado. Primer cajón con hendidura para salvar el sifón.<br>Disponible en las medidas de 60, 70 y 80cm.<br>Disponible en blanco, burdeos, grafito o beige. Medidas Ancho:60cm Fondo:45cm Alto:82cm;<table><tr><td>Referencia</td><td>00VIFAN1</td></tr><tr><td>Colocación</td><td>Con Patas</td></tr></table>;/Images/Ecom/Gamma_ImagesProducts/PR020.jpg;/Images/Ecom/Gamma_ImagesProducts/PR020.jpg;/Images/Ecom/Gamma_ImagesProducts/PR020.jpg;;TRUE;;Otro;;Con patas
PR021;PR021;Alto de colgar NARANJA;GR004,GR053,GR055;0;0;49;100;;Alto de colgar de acero.<br>Medidas 27x57x12;<table><tr><td>Referencia</td><td>AACCE039</td></tr><tr><td>Color</td><td>Multicolor</td></tr><tr><td>Ean</td><td>8435233816531</td></tr><tr><td>Marca</td><td>Atrezzo</td></tr><tr><td>Tipo</td><td>Semi Columna</td></tr></table>;/Images/Ecom/Gamma_ImagesProducts/PR021.jpg;/Images/Ecom/Gamma_ImagesProducts/PR021.jpg;/Images/Ecom/Gamma_ImagesProducts/PR021.jpg;;;Naranja;27;;
PR022;PR022;Alto de colgar BUTTERFLY;GR004,GR051,GR056;0;0;29;100;;Alto de colgar de acero Butterfly.<br>Medidas 30x30x12;<table><tr><td>Referencia</td><td>AACCE038</td></tr><tr><td>Color</td><td>Multicolor</td></tr><tr><td>Ean</td><td>8435233816524</td></tr><tr><td>Marca</td><td>Atrezzo</td></tr><tr><td>Tipo</td><td>Cubo</td></tr></table>;/Images/Ecom/Gamma_ImagesProducts/PR022.jpg;/Images/Ecom/Gamma_ImagesProducts/PR022.jpg;/Images/Ecom/Gamma_ImagesProducts/PR022.jpg;;;Butterfly;30;;
PR023;PR023;Espejo HAFA 80x90 Beige;GR005,GR052,GR057;0;0;68.5;100;;Espejo rectangular HAFA de 80x90 cm marco madera beige. Puedes colocarlo vertical o horizontalmente.<br>Para combinar con todas las series de muebles FAN.;<table><tr><td>Referencia</td><td>VHAFA180</td></tr><tr><td>Color</td><td>Beige</td></tr><tr><td>Ean</td><td>8435233872995</td></tr><tr><td>Marca</td><td>GAMMA TATTOM</td></tr><tr><td>Medidas</td><td>80 x 90 cm</td></tr></table>;/Images/Ecom/Gamma_ImagesProducts/PR023.jpg;/Images/Ecom/Gamma_ImagesProducts/PR023.jpg;/Images/Ecom/Gamma_ImagesProducts/PR023.jpg;;;Beige;80;;
PR024;PR024;Espejo HAFA 80x90cm blanco;GR005,GR053,GR058;0;0;66.5;100;;Espejo rectangular HAFA de 80x90cm marco madera blanco. Puedes colocarlo vertical o horizotalmente.<br>Para combinar con la serie de muebles FAN, TWIT y MATTY.;<table><tr><td>Referencia</td><td>VHAFA030</td></tr><tr><td>Ean</td><td>8435233855745</td></tr><tr><td>Marca</td><td>GAMMA TATTOM</td></tr><tr><td>Medidas</td><td>80 x 90 cm</td></tr></table>;/Images/Ecom/Gamma_ImagesProducts/PR024.jpg;/Images/Ecom/Gamma_ImagesProducts/PR024.jpg;/Images/Ecom/Gamma_ImagesProducts/PR024.jpg;;;Blanco;80;;
PR025;PR025;Espejo PRINT 90x90cm;GR005,GR051,GR059;0;0;77.5;100;;Mirall quadrat PRINT de 90x90 cm per al bany.;<table><tr><td>Referencia</td><td>TATES009</td></tr><tr><td>Ean</td><td>8435233824123</td></tr><tr><td>Marca</td><td>GAMMA TATTOM</td></tr><tr><td>Medidas</td><td>90 x 90 cm</td></tr></table>;/Images/Ecom/Gamma_ImagesProducts/PR025.jpg;/Images/Ecom/Gamma_ImagesProducts/PR025.jpg;/Images/Ecom/Gamma_ImagesProducts/PR025.jpg;;;;90;;
PR026;PR026;Espejo CRAKELADO Dorado;GR005,GR052,GR055;0;0;58;100;;Espejo de cristal crakelado en color Dorado.<br>Medidas 80x50;<table><tr><td>Referencia</td><td>CRAKI001</td></tr><tr><td>Color</td><td>Dorado</td></tr><tr><td>Ean</td><td>8435233824055</td></tr><tr><td>Marca</td><td>Atrezzo</td></tr><tr><td>Medidas</td><td>50 x 80 cm</td></tr></table>;/Images/Ecom/Gamma_ImagesProducts/PR026.jpg;/Images/Ecom/Gamma_ImagesProducts/PR026.jpg;/Images/Ecom/Gamma_ImagesProducts/PR026.jpg;;;Dorado;50;;
PR027;PR027;Espejo HAFA 60x90cm blanco;GR005,GR053,GR056;0;0;57.5;100;;Espejo rectangular HAFA de 60x90 cm con marco de madera blanco. Puedes colocarlo vertical o horizontal.<br>Para combinar con la serie de muebles FAN, TWIT y MATTY.;<table><tr><td>Referencia</td><td>VHAFA010</td></tr><tr><td>Ean</td><td>8435233855721</td></tr><tr><td>Marca</td><td>GAMMA TATTOM</td></tr><tr><td>Medidas</td><td>60 x 90 cm</td></tr></table>;/Images/Ecom/Gamma_ImagesProducts/PR027.jpg;/Images/Ecom/Gamma_ImagesProducts/PR027.jpg;/Images/Ecom/Gamma_ImagesProducts/PR027.jpg;;;Blanco;60;;
PR028;PR028;Espejo URBAN 70x70cm;GR005,GR051,GR057;0;0;49;100;;Espejo cuadrado URBAN de 70x70 cm para baño.;<table><tr><td>Referencia</td><td>TATES007</td></tr><tr><td>Ean</td><td>8435233824109</td></tr><tr><td>Marca</td><td>GAMMA TATTOM</td></tr><tr><td>Medidas</td><td>70 x 70 cm</td></tr></table>;/Images/Ecom/Gamma_ImagesProducts/PR028.jpg;/Images/Ecom/Gamma_ImagesProducts/PR028.jpg;/Images/Ecom/Gamma_ImagesProducts/PR028.jpg;;;;70;;
PR029;PR029;Espejo MAT 80x120cm;GR005,GR052,GR058;0;0;86.5;100;;Espejo rectangular MAT de 120x80 cm. Para colocar vertical o horizontal.;<table><tr><td>Referencia</td><td>TATES024</td></tr><tr><td>Ean</td><td>8435233858067</td></tr><tr><td>Marca</td><td>GAMMA TATTOM</td></tr><tr><td>Medidas</td><td>80 x 120 cm</td></tr></table>;/Images/Ecom/Gamma_ImagesProducts/PR029.jpg;/Images/Ecom/Gamma_ImagesProducts/PR029.jpg;/Images/Ecom/Gamma_ImagesProducts/PR029.jpg;;;;80;;
PR030;PR030;Espejo HAFA 80x90 Grafito;GR005,GR053,GR059;0;0;68.5;100;;Espejo rectangular HAFA de 80x90 cm marco madera grafito. Puedes colocarlo vertical o horizontalmente.<br>Para combinar con las serie de muebles FAN.;<table><tr><td>Referencia</td><td>VHAFA190</td></tr><tr><td>Color</td><td>Grafito</td></tr><tr><td>Ean</td><td>8435233873008</td></tr><tr><td>Marca</td><td>GAMMA TATTOM</td></tr><tr><td>Medidas</td><td>80 x 90 cm</td></tr></table>;/Images/Ecom/Gamma_ImagesProducts/PR030.jpg;/Images/Ecom/Gamma_ImagesProducts/PR030.jpg;/Images/Ecom/Gamma_ImagesProducts/PR030.jpg;;;Grafito;80;;
PR031;PR031;Espejo HAFA 100x90cm blanco;GR005,GR051,GR055;0;0;72.5;100;;Espejo rectangular HAFA de 100x90cm marco madera blanco. Puedes colocarlo vertical o horizontalmente.<br>Para combinar con la serie de muebles FAN, TWIT y MATTY.;<table><tr><td>Referencia</td><td>VHAFA040</td></tr><tr><td>Ean</td><td>8435233855752</td></tr><tr><td>Marca</td><td>GAMMA TATTOM</td></tr><tr><td>Medidas</td><td>90 x 100 cm</td></tr></table>;/Images/Ecom/Gamma_ImagesProducts/PR031.jpg;/Images/Ecom/Gamma_ImagesProducts/PR031.jpg;/Images/Ecom/Gamma_ImagesProducts/PR031.jpg;;;Blanco;100;;
PR032;PR032;Espejo PLAN 70x80cm;GR005,GR052,GR056;0;0;59;100;;Espejo rectangular PLAN de 80x70 cm. Para colocar vertical o horizontal.;<table><tr><td>Referencia</td><td>TATES022</td></tr><tr><td>Ean</td><td>8435233858043</td></tr><tr><td>Marca</td><td>GAMMA TATTOM</td></tr><tr><td>Medidas</td><td>70 x 80 cm</td></tr></table>;/Images/Ecom/Gamma_ImagesProducts/PR032.jpg;/Images/Ecom/Gamma_ImagesProducts/PR032.jpg;/Images/Ecom/Gamma_ImagesProducts/PR032.jpg;;;;70;;
PR033;PR033;Espejo CRAKELADO Negro;GR005,GR053,GR057;0;0;58;100;;Espejo de cristal crakelado en color Negro.<br>Medidas 80x50;<table><tr><td>Referencia</td><td>CRAKI002</td></tr><tr><td>Color</td><td>Negro</td></tr><tr><td>Ean</td><td>8435233824062</td></tr><tr><td>Marca</td><td>Atrezzo</td></tr><tr><td>Medidas</td><td>50 x 80 cm</td></tr></table>;/Images/Ecom/Gamma_ImagesProducts/PR033.jpg;/Images/Ecom/Gamma_ImagesProducts/PR033.jpg;/Images/Ecom/Gamma_ImagesProducts/PR033.jpg;;;Negro;50;;
PR034;PR034;Espejos con marco LOOK;GR005,GR051,GR058;0;0;37;100;;Espejos rectangulares LOOK marco arenado. Para colocar vertical o horizontal.<br>Medidas disponibles: 50x80 cm, 60x80 cm, 70x80 cm, 80x80 cm y 70x100 cm.;<table><tr><td>Referencia</td><td>00BPESP1</td></tr><tr><td>Marca</td><td>GAMMA TATTOM</td></tr></table>;/Images/Ecom/Gamma_ImagesProducts/PR034.jpg;/Images/Ecom/Gamma_ImagesProducts/PR034.jpg;/Images/Ecom/Gamma_ImagesProducts/PR034.jpg;;;;Otro;;
PR035;PR035;Aplique COSMO 20;GR006,GR052,GR059;0;0;79;100;;Aplique con luz LED COSMO 20. Aplique acabado cromo brillo y sistema de sujeción multienganche (para atornillar a madera, sobre espejo o camerino).<br>Consumo 6W. Temperatura 5700K Longitud 28,6 cm.;<table><tr><td>Referencia</td><td>APLTA070</td></tr><tr><td>Ean</td><td>8435233878881</td></tr><tr><td>Marca</td><td>GAMMA TATTOM</td></tr><tr><td>Tipo</td><td>LED</td></tr></table>;/Images/Ecom/Gamma_ImagesProducts/PR035.jpg;/Images/Ecom/Gamma_ImagesProducts/PR035.jpg;/Images/Ecom/Gamma_ImagesProducts/PR035.jpg;;;;20;;
PR036;PR036;Aplique PULSAR 45;GR006,GR053,GR055;0;0;72.5;100;;Aplique con luz LED PULSAR 45. Aplique acabado cromo brillo y sistema de sujeción multienganche (para atornillar a madera, sobre espejo o camerino).<br>Consumo 4,8W. Temperatura 6000K. Longitud 45 cm.;<table><tr><td>Referencia</td><td>APLTA020</td></tr><tr><td>Ancho</td><td>45 cm</td></tr><tr><td>Ean</td><td>8435233878836</td></tr><tr><td>Marca</td><td>GAMMA TATTOM</td></tr><tr><td>Tipo</td><td>LED</td></tr></table>;/Images/Ecom/Gamma_ImagesProducts/PR036.jpg;/Images/Ecom/Gamma_ImagesProducts/PR036.jpg;/Images/Ecom/Gamma_ImagesProducts/PR036.jpg;;;;45;;
PR037;PR037;Aplique PULSAR 60;GR006,GR051,GR056;0;0;82.5;100;;Aplique con luz LED PULSAR 60. Aplique acabado cromo brillo y sistema de sujeción multienganche (para atornillar a madera, sobre espejo o camerino).<br>Consumo 9,6W. Temperatura 5900K Longitud 60 cm.;<table><tr><td>Referencia</td><td>APLTA030</td></tr><tr><td>Ancho</td><td>60 cm</td></tr><tr><td>Ean</td><td>8435233878843</td></tr><tr><td>Marca</td><td>GAMMA TATTOM</td></tr><tr><td>Tipo</td><td>LED</td></tr></table>;/Images/Ecom/Gamma_ImagesProducts/PR037.jpg;/Images/Ecom/Gamma_ImagesProducts/PR037.jpg;/Images/Ecom/Gamma_ImagesProducts/PR037.jpg;;;;60;;
PR038;PR038;Aplique PULSAR 30;GR006,GR052,GR057;0;0;57.5;100;;Aplique con luz LED PULSAR 30. Aplique acabado cromo brillo y sistema de sujeción multienganche (para atornillar a madera, sobre espejo o camerino).<br>Consumo 4,8W. Temperatura 6400K. Longitud 30 cm.;<table><tr><td>Referencia</td><td>APLTA010</td></tr><tr><td>Ancho</td><td>30 cm</td></tr><tr><td>Ean</td><td>8435233878829</td></tr><tr><td>Marca</td><td>GAMMA TATTOM</td></tr><tr><td>Tipo</td><td>LED</td></tr></table>;/Images/Ecom/Gamma_ImagesProducts/PR038.jpg;/Images/Ecom/Gamma_ImagesProducts/PR038.jpg;/Images/Ecom/Gamma_ImagesProducts/PR038.jpg;;;;30;;
PR039;PR039;Lavabo CODIGO II 81x46 cm;GR008,GR053,GR058;0;0;86.5;100;;Lavabo de porcelana CODIGO II de 81x46 cm. Formas suaves y simples caracterizan esta serie.<br>Fabricado en porcelana. Gran resistencia a los impactos. Sin esquinas interiores que facilitan su limpieza. Dispone de prácticos espacios laterales para colocar tus accesorios de baño.<br>Fondo 46 cm, también disponible en fondo reducido de 39 cm.;<table><tr><td>Referencia</td><td>RAICO082</td></tr><tr><td>Ancho</td><td>81 cm</td></tr><tr><td>Color</td><td>Blanco</td></tr><tr><td>Ean</td><td>8435233830834</td></tr><tr><td>Fondo</td><td>46 cm</td></tr><tr><td>Marca</td><td>GAMMA RAIFEN</td></tr><tr><td>Medidas</td><td>81 x 46 cm</td></tr></table>;/Images/Ecom/Gamma_ImagesProducts/PR039.jpg;/Images/Ecom/Gamma_ImagesProducts/PR039.jpg;/Images/Ecom/Gamma_ImagesProducts/PR039.jpg;;;;80;;
PR040;PR040;Lavabo Railv28;GR008,GR051,GR059;0;0;139;100;;Lavabo Railv28;<table><tr><td>Referencia</td><td>RAILV028</td></tr><tr><td>Ean</td><td>8435233886091</td></tr><tr><td>Marca</td><td>RAIFEN</td></tr></table>;/Images/Ecom/Gamma_ImagesProducts/PR040.jpg;/Images/Ecom/Gamma_ImagesProducts/PR040.jpg;/Images/Ecom/Gamma_ImagesProducts/PR040.jpg;;;;;;
